<?xml version="1.0" encoding="UTF-8"?>

<obras xmlns:xsi="http://www.w3.org/2001/XMLSchema-instance"
       xsi:noNamespaceSchemaLocation="sala-imagem.xsd">

  <obra posicao="quadro-esquerda">
    <titulo>A Escola de Atenas</titulo>
    <autor>Rafael Sanzio</autor>
    <ano_nascimento_autor>1483</ano_nascimento_autor>
    <ano_morte_autor>1520</ano_morte_autor>
    <imagem>img/obras/a-escola-de-atenas.jpg</imagem>
    <descricao>Obra renascentista que representa filósofos e pensadores da Antiguidade.</descricao>
  </obra>

  <obra posicao="quadro-centro">
    <titulo>Santa Ceia</titulo>
    <autor>Leonardo da Vinci</autor>
    <ano_nascimento_autor>1452</ano_nascimento_autor>
    <ano_morte_autor>1519</ano_morte_autor>
    <imagem>img/obras/santa-ceia.jpg</imagem>
    <descricao>Representação do momento da última refeição de Cristo com os seus discípulos.</descricao>
  </obra>

  <obra posicao="quadro-direita">
    <titulo>Viagem a Lua</titulo>
    <autor>Georges Melies</autor>
    <ano_nascimento_autor>1861</ano_nascimento_autor>
    <ano_morte_autor>1938</ano_morte_autor>
    <imagem>img/obras/viagem-a-lua.jpg</imagem>
    <descricao>Obra marcante da história do cinema, associada ao imaginário da viagem espacial.</descricao>
  </obra>

</obras>